{
  "id": "0192f0d2-0000-7000-8000-000000000115",
  "type": "horus.devices.customer.kind_changed",
  "source": "horus/devices",
  "subject": "0192f0c4-7a1e-7c3a-9b1d-2f6e8a4c1d55",
  "time": "2026-10-07T14:03:11.123Z",
  "schema_version": 1,
  "tenant_id": "0192e000-0000-7000-8000-000000000001",
  "aggregate_type": "customer",
  "aggregate_version": 3,
  "actor": {
    "type": "user",
    "id": "0192aaaa-0000-7000-8000-0000000000a1",
    "sid": "0192bbbb-0000-7000-8000-0000000000b1",
    "via": "session",
    "via_platform": false
  },
  "trace_parent": "00-4bf92f3577b34da6a3ce929d0e0e4736-00f067aa0ba902b7-01",
  "correlation_id": null,
  "causation_id": null,
  "data": {
    "id": "0192f0c4-7a1e-7c3a-9b1d-2f6e8a4c1d55",
    "version": 3,
    "address": "10.20.0.41",
    "realm_id": "0192e111-0000-7000-8000-000000000011",
    "site_id": "0192e222-0000-7000-8000-000000000022",
    "client_prefix_id": "0192e444-0000-7000-8000-000000000044",
    "kind": "commercial",
    "kind_source": "manual",
    "kind_locked": true,
    "kind_confidence": null,
    "commercial_use_suspected": false,
    "status": "active",
    "alias": null,
    "first_seen": "2026-10-07T13:55:00.000Z",
    "last_seen": "2026-10-07T13:55:00.000Z",
    "reset_at": null,
    "change": {
      "from_kind": "residential",
      "to_kind": "commercial",
      "source": "manual",
      "model_ref": null,
      "reasons": [],
      "manual_reason": "Contrato empresarial verificado",
      "causation_event_id": null,
      "changed_at": "2026-10-07T14:03:11.123Z"
    }
  }
}
