{
  "id": "0192f0d2-0000-7000-8000-000000000802",
  "type": "horus.snmp.uplink.condition_changed",
  "source": "horus/snmp",
  "subject": "0192f9a1-0000-7000-8000-0000000009c1",
  "time": "2026-10-16T20:15:00.000Z",
  "schema_version": 1,
  "tenant_id": "0192e000-0000-7000-8000-000000000001",
  "aggregate_type": "uplink",
  "aggregate_version": 1,
  "actor": {
    "type": "service",
    "id": "svc:snmp",
    "via_platform": false
  },
  "trace_parent": null,
  "correlation_id": null,
  "causation_id": null,
  "data": {
    "tenant_id": "0192e000-0000-7000-8000-000000000001",
    "interface_id": "0192f9a1-0000-7000-8000-0000000009c1",
    "router_id": "0192e333-0000-7000-8000-000000000031",
    "site_id": "0192e111-0000-7000-8000-000000000011",
    "router_name": "rt-core-centro",
    "site_name": "Nodo Centro",
    "interface_name": "sfp-sfpplus1",
    "label": "Proveedor A 1G",
    "condition": "saturation",
    "previous_level": "ok",
    "level": "critical",
    "value": 0.923,
    "threshold": 0.85,
    "unit": "ratio",
    "since": "2026-10-16T20:00:00.000Z",
    "observed_at": "2026-10-16T20:15:00.000Z"
  }
}
