{
  "id": "0192f0d2-0000-7000-8000-000000000008",
  "type": "horus.auth.kiosk.enrolled",
  "source": "horus/auth",
  "subject": "0192f777-0000-7000-8000-000000000077",
  "time": "2026-10-07T14:03:11.123Z",
  "schema_version": 1,
  "tenant_id": "0192e000-0000-7000-8000-000000000001",
  "aggregate_type": "kiosk",
  "aggregate_version": 2,
  "actor": {
    "type": "kiosk",
    "id": "0192f777-0000-7000-8000-000000000077",
    "via_platform": false
  },
  "trace_parent": "00-4bf92f3577b34da6a3ce929d0e0e4736-00f067aa0ba902b7-01",
  "correlation_id": null,
  "causation_id": null,
  "data": {
    "id": "0192f777-0000-7000-8000-000000000077",
    "version": 2,
    "name": "TV sala NOC",
    "status": "active",
    "reason": null,
    "playlist_id": "0192f000-0000-7000-8000-00000000e101",
    "dashboard_ids": [],
    "show_personal_data": false,
    "changed_at": "2026-10-07T14:03:11.123Z"
  }
}
