{
  "id": "0192f0d2-0000-7000-8000-000000000107",
  "type": "horus.devices.router.deleted",
  "source": "horus/devices",
  "subject": "0192e333-0000-7000-8000-000000000033",
  "time": "2026-10-07T14:03:11.123Z",
  "schema_version": 1,
  "tenant_id": "0192e000-0000-7000-8000-000000000001",
  "aggregate_type": "router",
  "aggregate_version": 9,
  "actor": {
    "type": "user",
    "id": "0192aaaa-0000-7000-8000-0000000000a1",
    "sid": "0192bbbb-0000-7000-8000-0000000000b1",
    "via": "session",
    "via_platform": false
  },
  "trace_parent": "00-4bf92f3577b34da6a3ce929d0e0e4736-00f067aa0ba902b7-01",
  "correlation_id": null,
  "causation_id": null,
  "data": {
    "id": "0192e333-0000-7000-8000-000000000033",
    "version": 9,
    "site_id": "0192e222-0000-7000-8000-000000000022",
    "name": "rt-centro-01",
    "display_name": null,
    "is_primary": true,
    "vendor": "mikrotik",
    "model": "CCR2116-12G-4S+",
    "routeros_version": "7.16.1",
    "routeros_version_supported": true,
    "admin_state": "decommissioned",
    "onboarding_state": "pending_configuration",
    "tunnel_address": null,
    "tags": [
      "core"
    ],
    "created_at": "2026-10-07T12:00:00.000Z",
    "updated_at": "2026-10-07T12:00:00.000Z",
    "deleted_at": "2026-10-07T14:03:11.123Z",
    "changed_fields": []
  }
}
