{
  "id": "0192f0d2-0000-7000-8000-000000000112",
  "type": "horus.devices.client_prefix.deleted",
  "source": "horus/devices",
  "subject": "0192e444-0000-7000-8000-000000000044",
  "time": "2026-10-07T14:03:11.123Z",
  "schema_version": 1,
  "tenant_id": "0192e000-0000-7000-8000-000000000001",
  "aggregate_type": "client_prefix",
  "aggregate_version": 3,
  "actor": {
    "type": "user",
    "id": "0192aaaa-0000-7000-8000-0000000000a1",
    "sid": "0192bbbb-0000-7000-8000-0000000000b1",
    "via": "session",
    "via_platform": false
  },
  "trace_parent": "00-4bf92f3577b34da6a3ce929d0e0e4736-00f067aa0ba902b7-01",
  "correlation_id": null,
  "causation_id": null,
  "data": {
    "id": "0192e444-0000-7000-8000-000000000044",
    "version": 3,
    "site_id": "0192e222-0000-7000-8000-000000000022",
    "realm_id": "0192e111-0000-7000-8000-000000000011",
    "prefix": "10.20.0.0/24",
    "role": "customers",
    "assignment_mode": "dynamic",
    "default_kind": "residential",
    "ipv6_client_len": null,
    "source": "routeros_api",
    "confirmed": true,
    "created_at": "2026-10-07T12:00:00.000Z",
    "deleted_at": "2026-10-07T14:03:11.123Z",
    "changed_fields": []
  }
}
