{
  "id": "0192f0d2-0000-7000-8000-000000000205",
  "type": "horus.wireguard.peer.revoked",
  "source": "horus/wireguard",
  "subject": "0192e555-0000-7000-8000-000000000055",
  "time": "2026-10-07T14:03:11.123Z",
  "schema_version": 1,
  "tenant_id": "0192e000-0000-7000-8000-000000000001",
  "aggregate_type": "peer",
  "aggregate_version": 5,
  "actor": {
    "type": "user",
    "id": "0192aaaa-0000-7000-8000-0000000000a1",
    "sid": "0192bbbb-0000-7000-8000-0000000000b1",
    "via": "session",
    "via_platform": false
  },
  "trace_parent": "00-4bf92f3577b34da6a3ce929d0e0e4736-00f067aa0ba902b7-01",
  "correlation_id": null,
  "causation_id": null,
  "data": {
    "id": "0192e555-0000-7000-8000-000000000055",
    "version": 5,
    "server_id": "0192e666-0000-7000-8000-000000000066",
    "router_id": "0192e333-0000-7000-8000-000000000033",
    "status": "revoked",
    "public_key": "xTIBA5rboUvnH4htodjb6e697QjLERt1NAB4mZqp8Dg=",
    "address": "10.255.3.17/32",
    "allowed_ips": [
      "10.255.3.17/32"
    ],
    "persistent_keepalive_seconds": 25,
    "enrolled_from_ip": null,
    "enrolled_at": null,
    "activated_at": null,
    "reason": "router_decommissioned",
    "created_at": "2026-10-07T12:00:00.000Z",
    "changed_fields": [],
    "transport": "wireguard"
  }
}
