{
  "id": "0192f0d2-0000-7000-8000-000000000109",
  "type": "horus.devices.realm.updated",
  "source": "horus/devices",
  "subject": "0192e111-0000-7000-8000-000000000011",
  "time": "2026-10-07T14:03:11.123Z",
  "schema_version": 1,
  "tenant_id": "0192e000-0000-7000-8000-000000000001",
  "aggregate_type": "realm",
  "aggregate_version": 2,
  "actor": {
    "type": "service",
    "id": "svc:devices",
    "via_platform": false
  },
  "trace_parent": "00-4bf92f3577b34da6a3ce929d0e0e4736-00f067aa0ba902b7-01",
  "correlation_id": null,
  "causation_id": null,
  "data": {
    "id": "0192e111-0000-7000-8000-000000000011",
    "version": 2,
    "kind": "node_private",
    "site_id": "0192e222-0000-7000-8000-000000000022",
    "name": "Centro (privado)",
    "router_ids": [
      "0192e333-0000-7000-8000-000000000033"
    ]
  }
}
