{
  "id": "0192f0d2-0000-7000-8000-000000000101",
  "type": "horus.devices.audit.recorded",
  "source": "horus/devices",
  "subject": "0192f9f9-0000-7000-8000-0000000000f1",
  "time": "2026-10-07T14:03:11.123Z",
  "schema_version": 1,
  "tenant_id": "0192e000-0000-7000-8000-000000000001",
  "aggregate_type": "audit",
  "aggregate_version": 1,
  "actor": {
    "type": "user",
    "id": "0192aaaa-0000-7000-8000-0000000000a1",
    "sid": "0192bbbb-0000-7000-8000-0000000000b1",
    "via": "session",
    "via_platform": false
  },
  "trace_parent": "00-4bf92f3577b34da6a3ce929d0e0e4736-00f067aa0ba902b7-01",
  "correlation_id": null,
  "causation_id": null,
  "data": {
    "id": "0192f9f9-0000-7000-8000-0000000000f1",
    "tenant_id": "0192e000-0000-7000-8000-000000000001",
    "occurred_at": "2026-10-07T14:03:11.123Z",
    "source_service": "devices",
    "actor": {
      "type": "user",
      "id": "0192aaaa-0000-7000-8000-0000000000a1",
      "sid": "0192bbbb-0000-7000-8000-0000000000b1",
      "via": "session",
      "via_platform": false
    },
    "ip": "198.51.100.4",
    "user_agent": "Mozilla/5.0",
    "action": "customers.kind.write",
    "resource_type": "customer",
    "resource_id": "0192f0c4-7a1e-7c3a-9b1d-2f6e8a4c1d55",
    "scope": "tenant",
    "outcome": "success",
    "reason": null,
    "changes": {},
    "request_id": "0192cccc-0000-7000-8000-0000000000c9",
    "trace_id": "4bf92f3577b34da6a3ce929d0e0e4736"
  }
}
