{
  "id": "0192f0d2-0000-7000-8000-000000000130",
  "type": "horus.devices.asn_rule.created",
  "source": "horus/devices",
  "subject": "0192e555-0000-7000-8000-000000000055",
  "time": "2026-10-13T14:03:11.123Z",
  "schema_version": 1,
  "tenant_id": "0192e000-0000-7000-8000-000000000001",
  "aggregate_type": "asn_rule",
  "aggregate_version": 1,
  "actor": {
    "type": "user",
    "id": "0192aaaa-0000-7000-8000-0000000000a1",
    "sid": "0192bbbb-0000-7000-8000-0000000000b1",
    "via": "session",
    "via_platform": false
  },
  "trace_parent": "00-4bf92f3577b34da6a3ce929d0e0e4736-00f067aa0ba902b7-01",
  "correlation_id": null,
  "causation_id": null,
  "data": {
    "id": "0192e555-0000-7000-8000-000000000055",
    "version": 1,
    "asn": 263237,
    "name": "Fibra Andina",
    "category": "cdn_infra",
    "service": null,
    "created_at": "2026-10-13T14:03:11.123Z",
    "deleted_at": null,
    "changed_fields": []
  }
}
