{
  "id": "0192f0d2-0000-7000-8000-000000000309",
  "type": "horus.flows.exporter.state_changed",
  "source": "horus/flows",
  "subject": "0192e333-0000-7000-8000-000000000033",
  "time": "2026-10-07T14:03:11.123Z",
  "schema_version": 1,
  "tenant_id": "0192e000-0000-7000-8000-000000000001",
  "aggregate_type": "flow_exporter",
  "aggregate_version": 3,
  "actor": {
    "type": "service",
    "id": "svc:flows",
    "via_platform": false
  },
  "trace_parent": "00-4bf92f3577b34da6a3ce929d0e0e4736-00f067aa0ba902b7-01",
  "correlation_id": null,
  "causation_id": null,
  "data": {
    "router_id": "0192e333-0000-7000-8000-000000000033",
    "site_id": "0192e222-0000-7000-8000-000000000022",
    "version": 3,
    "previous_state": "pending_configuration",
    "state": "exporting",
    "last_flow_at": "2026-10-07T14:03:11.123Z",
    "loss_ratio_5m": 0.0,
    "clock_skew_seconds": 0.4,
    "changed_at": "2026-10-07T14:03:11.123Z"
  }
}
