{
  "id": "0192f0d2-0000-7000-8000-000000000706",
  "type": "horus.analytics.playlist.deleted",
  "source": "horus/analytics",
  "subject": "0192f000-0000-7000-8000-00000000e101",
  "time": "2026-10-07T14:03:11.123Z",
  "schema_version": 1,
  "tenant_id": "0192e000-0000-7000-8000-000000000001",
  "aggregate_type": "playlist",
  "aggregate_version": 3,
  "actor": {
    "type": "user",
    "id": "0192aaaa-0000-7000-8000-0000000000a1",
    "sid": "0192bbbb-0000-7000-8000-0000000000b1",
    "via": "session",
    "via_platform": false
  },
  "trace_parent": "00-4bf92f3577b34da6a3ce929d0e0e4736-00f067aa0ba902b7-01",
  "correlation_id": null,
  "causation_id": null,
  "data": {
    "id": "0192f000-0000-7000-8000-00000000e101",
    "version": 3,
    "name": "NOC + Seguridad",
    "items": [
      {
        "dashboard_id": "0192f000-0000-7000-8000-00000000d001",
        "duration_seconds": 30
      },
      {
        "dashboard_id": "0192f000-0000-7000-8000-00000000d002",
        "duration_seconds": 30
      }
    ],
    "transition": "fade",
    "updated_at": "2026-10-07T14:03:11.123Z"
  }
}
