{
  "id": "0192f0d2-0000-7000-8000-000000000118",
  "type": "horus.devices.customer.reset",
  "source": "horus/devices",
  "subject": "0192f0c4-7a1e-7c3a-9b1d-2f6e8a4c1d55",
  "time": "2026-10-07T14:03:11.123Z",
  "schema_version": 1,
  "tenant_id": "0192e000-0000-7000-8000-000000000001",
  "aggregate_type": "customer",
  "aggregate_version": 6,
  "actor": {
    "type": "user",
    "id": "0192aaaa-0000-7000-8000-0000000000a1",
    "sid": "0192bbbb-0000-7000-8000-0000000000b1",
    "via": "session",
    "via_platform": false
  },
  "trace_parent": "00-4bf92f3577b34da6a3ce929d0e0e4736-00f067aa0ba902b7-01",
  "correlation_id": null,
  "causation_id": null,
  "data": {
    "id": "0192f0c4-7a1e-7c3a-9b1d-2f6e8a4c1d55",
    "version": 6,
    "address": "10.20.0.41",
    "kind": "residential",
    "kind_source": "default",
    "kind_locked": false,
    "alias": null,
    "reset_at": "2026-10-07T14:03:11.123Z",
    "reason": "La IP pasó a otro abonado"
  }
}
